{
  "schema_version": "1.0",
  "task_id": "WG-TASK-0001",
  "work_item_id": "WI-001",
  "role": "workers_executor",
  "agent_id": "workers_executor",
  "status": "READY_FOR_QA",
  "summary": "已完成指派範圍並保存驗證證據。",
  "facts": ["已執行 acceptance command。"],
  "assumptions": [],
  "actions_taken": ["完成已核准修改。"],
  "commands_run": [{"command": "python -m unittest", "exit_code": 0}],
  "files_changed": ["path/to/owned-file"],
  "tests": [{"command": "python -m unittest", "passed": 1, "failed": 0, "skipped": 0}],
  "evidence": [".workers-group/evidence/WG-AC-001.txt"],
  "blockers": [],
  "risks": [],
  "remaining_work": [],
  "memories_used": [],
  "memory_candidates": [],
  "confidence": 1.0,
  "timestamp": "2026-07-30T00:00:00+08:00"
}
